{
  "schema": 1,
  "about": "Seed project config for the factory kernel tools (tools/factory/kernel-subjects.py, kernel-receipt.py). Every key is required and no other key is allowed (K137). Copy it, then rename every value to your project's own; it NAMES things, it never decides credit.",
  "subject": {
    "prefix": "seed/",
    "row": "S[0-9]+",
    "branch_prefix": "work/",
    "delivery": "master via --no-ff landing",
    "default_products": ["src/", "tests/"]
  },
  "paths": {
    "briefs": "review/briefs/",
    "review": "review/",
    "receipts": "review/kernel-receipts/",
    "subjects_tool": "factory-pins/factory-pins.json",
    "tools_bar_runner": "tools/run-tools-bar.py"
  },
  "bar": {
    "runner": "seed-runner",
    "hosted_runner": "GitHub Actions [0-9]+",
    "tools_workflow": "tools-bar",
    "product_workflow": "product-bar",
    "workflow_suffix": "-bar"
  },
  "contract_defaults": {
    "bar": "the CI bar workflows (product-bar and tools-bar) dispatched at the exact candidate SHA and at the landing merge; each run is the bar of record for its SHA",
    "passes": "3 identical green passes at one SHA; passed, failed, skipped and excluded counted separately",
    "env": "the bar workflow's runs-on as resolved at the run (Runner name {runner}); its Python",
    "harness-limits": "the bar workflow's job timeout, as committed at the candidate SHA",
    "seats": "2-3 non-author read-only review seats, each with a different attack question",
    "review-scope": "the packet's diff against master at the candidate SHA, and every reader of what it changes",
    "rounds": "not capped by count; a finding blocks only with a reproduction at the candidate SHA",
    "planted-edits": "every new pin is shown red by a planted break before review",
    "charter": "no independent key dispatched (pending-cross-family)"
  }
}
